index,text,title
0,,‘Star Trek: Discovery’ Cast Tease Juicy Storyline For Spock And More In Season 2
1,,The Shuttlecraft Galileo NCC-1701/7 Blueprints -- A blast from the past...
2,,"If it's ever necessary to show young Picard, he should be played by James McAvoy."
3,,Throwback to everythingisterrible discovering the VHS for TNG boardgame
4,,"Composers Ron Jones, Dennis McCarthy and Jay Chattaway talk about their work for TNG"
5,https://imgur.com/e5zd072,Guys? I think I found Captain Boday
6,"So I've been meaning to get into watching Star Trek for a while now, having seen random episodes before. I was looking to get into TNG primarily before watching the other series. I don't have Netflix, so how far can I go with that? Does it have all the series? Are there any other cheap alternatives to Netflix? Thank you!",Easiest/Cheapest way to get into Star Trek
7,https://i.imgur.com/NpofyEc.jpg,The Carnival that comes to my city every year has a Pirate Worf [Image (OC)]
8,,Doorway to the Enterprise-D Bridge Bathroom | TrekCore.com on Twitter
9,,William Shatner Thinks He Doomed ‘Star Trek V’ By Directing
10,,"If you could name ship in an upcoming trek show or film, what would you name it?"
11,([https://i.imgur.com/NXNIxOp.jpg](https://i.imgur.com/NXNIxOp.jpg),I suddenly realised I had a very Star Trek related weekend. Enterpriseception?
12,,Lessons From Fan Expo: The Cast Of Star Trek: Discovery—They’re Just Like Us
13,,"Karl Urban Confident ‘Star Trek 4’ Negotiations Will Be Resolved, Production Set For U.K."
14,"Just what the title says :-)

[https://youtu.be/mpvA1itBIKU](https://youtu.be/mpvA1itBIKU)

​","New TNG era fan film, ""The Holy Core"", behind-the-scenes on the Ready Room set"
15,"So at per this article https://trekmovie.com/2018/09/01/picard-show-executive-producer-michael-chabon-reveals-his-star-trek-galactic-map-briefing/,  the writers of the show (currently Discovery and future Picard show), the Klingon and Romulan empires are in the Beta quadrant. I have not heard this in any of the shows and always assumed that all major powers we saw in TNG are in the Alpha quadrant. Is that not the case?",Are Klingons and Romulans in the Beta quadrant?
16,"(https://i.imgur.com/bMj2uxo.jpg)

The galaxy skin is from decalgirl.com and the two trek stickers are from Etsy. ",Spruced up my surface today
17,"I would personally love to see a Captain Harry Kim!   
Any chance Garret Wang might be interested in what I can only hope to be a much better production!?",With all the possibilities of a Future Trek...
18,"..and after a rocky tide through 1 and a half seasons, I'm quite enjoying it. I think Whispers was the episode that really hooked me, but a couple episodes prior were also really good. I just enjoy Chief O'Brien as a character, and that episode gave me some of my favorite performances so far. There are still some production techniques that irk me, but none so much so that they pull me away from the show. The new actors have all come into their characters quite well, and all have me actually looking forward to seeing how they will develop; despite some rather horrid line deliveries in the first season, especially the first half of episode one. I'm glad I persevered through due to how much love I'd read online, despite my friends insistence on their dislike of this series. No real point to this post beyond this, I guess, I just wanted to share my experience, thanks for reading!","I've just started DS9, with apprehension, based on friends of mine opinions.."
19,,Winblows 98: Star Tech the NeXT Generation
20,https://i.imgur.com/QdLvduv.gifv,"President of the United Federation of Planets, Red Forman. 2293 (colorized)"
21,,Star Trek Documentation: The Cast and Crew reflects on TNG's Season 1
22,,"ONTARIO: Trudeau goes to Timmins, ends up in Klingon selfie"
23,"Just rewatching 'Yesterday's Enterprise' and I've never noticed that when the console explodes the result is...flying rocks...

What does a Starship need rocks for? ",why does a Starship need rocks?
24,Garriott just shared this at Dragon Con. ,Richard Garriott smuggled James Doohan's ashes aboard the ISS and apparently they're still there.
25,"(Small story: So my dad was an casual fan only watching some episodes when they were on TV of TOS, TNG and VOY and since I got mad Into It, I've decided to watch episodes of TOS and TNG and since he never saw an episode of DS9, It was hard to get him to like it since it was different but me being the pain in the butt I am I've got him to watch DS9 and after season 3 he really loved it to the point we finished the entire series (watching most of the episodes), Currently we are on season 7 of Voyager which he really likes as-well and it's been a blast re-watching it for the second time for me.)

I am really looking forward for him to finish the final season of voyager and there are many good episodes left but more-so I am looking forward for him to look at ENT as I know it'll be something he'll like, It's a fantastic prequel and he'll like the time travel aspect of it! It'll show him how the first contact with the Klingons was like and how controlling and disliked the vulcans were! He'll know about the andorians and the amazing writing the show had for them and Jeffery Combs! I am excited to watch the first episode as I was instantly hooked from that episode and the tbh my favorite first episode of any ST series, Yeah I am a fanboy of ENT and take proud In it, but... DS9 will still hit #1 for me, ENT is a close second, I dnk why I felt the urge to post this but I did.",I've got my dad Into ST and I am looking forward for him to see ENT after VOY
26,"[https://www.instagram.com/p/BnKdUPJh35j/?hl=en&amp;taken-by=michael.chabon](https://www.instagram.com/p/BnKdUPJh35j/?hl=en&amp;taken-by=michael.chabon)

""*Supreme Guardian of All* [*#Trek*](https://www.instagram.com/explore/tags/trek/) *Canon (and beloved colleague)* [*#kirstenbeyer*](https://www.instagram.com/explore/tags/kirstenbeyer/) *dropped some cosmographical science on the* [*#untitledpicardproject*](https://www.instagram.com/explore/tags/untitledpicardproject/) *writers’ room today. (Yes, I am having* [*#somuchfun*](https://www.instagram.com/explore/tags/somuchfun/)*.)""*",Novelist (and Picard series producer/writer) Michael Chabon posted a photo from the writers room...
27,,15 Things You Didn’t Know About Garak(DS9)
28,"TOS S02E13 ""Obsession"", scrub to near the end with 5:55 left.

Never noticed this before, do you think they just forgot?",I found a non up-ressed ship scene in a TOS episode on Netflix
29,"Watching ENT for the first time, and I'm baffled by this planet view. As far as I can tell, the whole opening credits are about earth, with a bunch of historic photos from the progress from flight to space, so it would seem to make sense that this image is of earth.

But looking at it every which way I cannot figure out where we're at. Is it a CGI image of some other fictional planet?

https://i.imgur.com/1UVkXJv.jpg
",What is this planet in the S01 ENT opening credits?
30,"Guess I'm just wondering if it's higher quality, how good the bonus features are, etc.","TOS on bluray, is it worth it vs streaming?"
31,"I was just rewatching ""Take Me Out to the Holosuite"" in DS9 and Sisko has this rivalry with an all-Vulcan ship. [Memory Alpha](http://memory-alpha.wikia.com/wiki/USS\_T%27Kumbra) even describes other ships that had all-Vulcan crews.

This struck me as pretty odd that the Federation would consider this normal. They spend so much time making sure crews are inclusive of every species, but Vulcans get to be racist and exclude everyone else from their ships? Imagine the outrage if Humans said they wanted all-Human ships. So why do the Vulcans get to do this?

​",Why are there all-Vulcan ships in Starfleet?
32,"—likely to be controversial

I’ve tried watching a few episodes, remaining as objective as possible, but this show seems to always leave me unsatisfied and ultimately puzzled as to what the writers were going for with a lot of the choices they made during production. It just doesn’t ‘feel’ like Star Trek to me.

I watched [this](https://m.youtube.com/watch?v=ZOSn0d56Eqw&amp;amp;feature=youtu.be&amp;amp;t=1m29s) scene the other day. At first, I was just confused, so I rewatched it; after the second time through, I was no less confused as to what exactly it was that I just saw, but this time i became suddenly appalled by the realization that this show carries the same name as previous installments of the franchise such as The Next Generation or even The Original Series. 

Now don’t get me wrong, I’m open to new ideas and even a new direction for the franchise entirely, but this just doesn’t seem right to me. I’d like some opposing opinions on the matter to consider. 

Here are some scenes from past series that are similar in nature to this one, yet, in my opinion, retain more of what I would consider the underlying themes of Star Trek as a whole: [1](https://youtu.be/JGn948_PXTU?t=1m23s), [2](https://www.youtube.com/watch?v=jVmldpYnFzw), or even [3](https://youtu.be/zlGRNRAL148?t=30s). 

For me, Star Trek Discovery is the confused grandchild of a tv show that was supposed to explore our inner selves more so than anything else. It is overly overt, distractingly glamorous, and too concerned with setting its self apart from the past that it often falls short in the areas that truly matter. 

Edit: 

1) As many of you have stated, and correctly so, Discovery is still in its infancy as a tv show. It would be wrong in saying that all the past shows did not have a rocky beginning as well, so it is best to remain open minded. However, I can say that I think out of all the shows, early season difficulties considered, Discovery still is the farthest from the rest both in terms of story telling and aesthetics. Ultimately, I will maintain a cautious yet optimistic outlook.

2) How the clips are related. 

I chose the three scenes from past Star Trek shows because, they are, at least in the most basic sense, similar in terms of subject and narrative, so there is a point of comparison to be made. Furthermore, I think there is a clear contrast between how the prior shows handled a scene like this compared to Discovery: This includes everything involved; plot, resolution, character interaction, visuals, effects, montage, camera use, etc. In full, the muse-en-scene  is what is in question. 
",What do you think about Star Trek Discovery?
33,"I started watching Star Trek for the first time last year, and I'm up to Voyager S3:E1. On the subject of Lon Suder (the homicidal + creepy Betazoid ex-Marquis), and the holographic doctor referred to him as a ""sociopath"". 


This may be a minor detail, but it's actually bothering me. He's listed as a sociopath where ever he's mentioned, but... Wouldn't it be more accurate to refer to him as a psychopath? 


As far as I'm aware, he has never shown remorse for killing his fellow crewmate. He's merely trying to control his homicidal urges. Nothing about him indicates to me that he is a ""sociopath"", yet everything about him indicates to me that he is a ""psychopath"". 


What's the deal? Did Star Trek's writers just make a mistake, and everyone just ""went with it"", and it became canon? Or am I mistaken? Technically you could call him a sociopath, but it just seems much more accurate to use the term psychopath. The medical doctor **should know the difference**. 


At best, this might be explained away by saying ""in 2373, the term psychopath no longer exists"" or something. 


Thoughts?","Lon Suder the ""sociopath""? (Voyager)"
34,,How Deep Space Nine changed Star Trek for the better.
35,"Please post your favorite ""scientific"" quotes or dialogue from any series.",Request for Technobabble
36,"
Rewatching DS9 Way of the Warrior and once again disturbed by Martok, Sisko and Kira using the same knife to cut their hands. I love how it shows the pointlessness of blood testing but I also wonder if the Klingon empire experienced an uptick in blood borne disease infections during the Dominion war.",Dominion war and spread of blood borne pathogens?
37,"I was watching the DS9 first season finale yesterday, In the Hands of the Prophets (still one of the most underrated season finale's ever). I was watching the scene Keiko O'Brien and evil woman Vedek Winn debate over the wormhole aliens, orbs, etc as a religion vs science issue. 

It was a good reminder how much DS9 went out of its way to create it's mini-universe within a universe. None of those concepts were ever heard of in Star Trek until DS9 introduced them. And they really built up those ideas more in later seasons. And of course their mythology got even bigger once the Dominion was introduced and gave us not just a new villain but a entire story line built around them that went on for years.

Then I started thinking about Star Trek in general and just how big the overall mythology has become because every show has added to it in some way offering up new conflicts, aliens and concepts.

All except Discovery. :(

It's crazy but it's true. Just stay with me here, but every show from TOS to Enterprise has all introduced completely new ideas and concepts to the Trek universe. Just a tiny example of what I mean:

TOS- Well it's obvious being the first it set up everything in the universe: Starfleet, Klingons. Vulcans, Romulan war, 23rd century, etc, etc. And pretty much every major element from that show has been used on most shows in some fashion. 

TNG- It's first season set up the 24th century, but also gave us the Ferengi (yeah, I know), Q, the Borg (although didn't actually see them until second season), crazy new tech like holodecks, etc. It gave us old elements from TOS like the Klingons and star ships, but it prided itself on presenting new aliens and threats in its very first season.

DS9 has been mentioned.

Voyager- LOL that entire show created multiple new species and concepts being in the Delta quadrant of course. The Borg became it's main threat in later seasons but Voyager had tons of new species to play with and created a lot stories around them like the Kazon and the Ocampa being the first major arc.

Enterprise- While it's a prequel it actually went out of its way to create a lot of new mythology and background. Being in the only show in the 22nd century basically set up that era the way TNG did with the 24th. It laid the ground work of how Starfleet was perceived in the early days of space travel. But it still went farther by giving us the Temporal Cold War and the Suliban in the first season. It introduced a completely new idea in Star Trek and different species fighting over various timelines. And then later of course we got the Xindi arc which added to TCW but were a new villain completely.

And then we get to Discovery. And sadly they have added nothing to their own like the other shows started out. The only original concept the show has created is the spore drive and mycelial network. It's completely new but it's more of a plot device instead of a brand new story line. But outside of that, what was new?  They stuck to the Star Trek tradition of introducing a new alien we never seen before in Saru but that's really it. They have filled in concepts other shows already created like the Mirror Universe and the Klingon war. Next season we're getting Section 31 but that came from DS9. 

Is it a big deal, no, since it just hit me recently they didn't do anything new but it is odd DIS for all it's talk of being 'different' and 'modern' hasn't created any truly original ideas outside of one. Even when it came to new aliens, there has basically been two introduced so far: Saru and the Phavo aliens, which we saw in one episode. We see others walk around but we know zip about them. 

So maybe next season this show will create it's own mythology unique to Discovery but so far it's seriously lagging behind the others which is weird given how all the other shows went out their way to create new villains, histories and concepts. ",My biggest disappointment in Discovery first season vs all the other shows....it didn't create any new mythology!
38,"""There were many things in my youth that I'm not proud of. They were...loose threads. Untidy parts of myself that I wanted to remove. But when I pulled on one of those threads, I unraveled the tapestry of my life."" - Captain Picard (S06E15)",Your daily message from Captain Picard
39,,"PSA: The Smithsonian Channel has its Star Trek documentary ""Building Star Trek,"" a doc about the search for original TOS props / sets, available to watch in its entirety for free on their website"
40,"I'm not talking about big, epic scenes of conflict, more smaller things that we didn't get to see much of.

For example, I would have loved a scene in TOS of Spock meeting with scientists from different divisions (physics, biology, chemistry, etc.) to get status reports of their recent work and experiments.",What's a scene you would have liked to have seen in your favorite Trek series?
41,"Hi Guys,

First time over at this sub but the last few years i've been getting right back into Star Trek and was hoping for some guidance. I just just finished Discovery and its made me want to watch more Star Trek TV shows because i loved it, i've only ever watched a very small part of Voyager, the new Kelvin Timeline movies and maybe 3 - 3/12 of the original Movies. Im going to watch all the movies, but have decided to chuck on the first ep of TNG because i love Patrick Stewart and i enjoyed it a lot. I dont want to watch all 178 episodes but would be keen to see what people think is the best list of shortened must watch episodes. I've seen that there a lists like this for other shows so was keen to get everyone's thoughts as there are a million lists online but i thought here is a better place to start.

Thanks!","Just got into Star Trek, Looking for help on shortened lists of must watch eps for TNG, DS9 and Voyager."
42,,"For the new Picard series, wouldn’t it be cool if the teaser was Picard suddenly finds himself back in Q’s courtroom, and Q appears behind him and says “The trial never ended.” And then cuts out?"
43,"Just seen this episode. I couldn't stop laughing at how moronic a supposedly trained starfleet officer, a security one at that, could be. 

You've got an exotic, dangerous, hostile and unfamiliar creature which if not actually sedated means guaranteed death for you. You'd think she might have been more cautious that the sedation worked on this unstudied creature before opening its cage door. 

I have not seen this level of stupidity since the dumbass biologist petting the snake alien in Prometheus. 

And what's randomly cutting off a limb gonna do? 

Why are sci-fi shows and film incapable of creating realistic and sane characters? Completely ruins the suspension of disbelief.",Discovery S1E4 Landry.... What?
44,,‘That isn’t for me’: William Shatner says he’s done with ‘Star Trek’
45,"In the TNG episode ""When the bough breaks"" the Aldeans need children and end up kidnapping the kids from the Enterprise. Why didn't the federation just hook them up with some orphans or something? ",Think of the children
46,&amp;#x200B;,any recipes for gagh that can be made here?
47,"I personally prefer DS9.I was into VOY until they just created the anti-assimilation inoculation out of thin air and then single-handledly handed the Borg their ass.Then I just couldn't bother.

I just found the writing in DS9 more consistent and solid and the characters more flushed out as the series progressed.  

Edit: Let me clarify why I am.asking.I was in a discussion with a group of people,and one guy found any reason to talk down about DS9 because he was a VOY fan.We tried to be reasonable and say both shows had good and bad,superior and inferior aspects, but he was adamant that VOY was far superior.  

I just want to get varied opinions.Thats all.Lets have a discussion without being pedantic.
",Is DS9 &gt; Voyager or is Voyager &gt; DS9?
48,,How Deep Space Nine Changed Star Trek for the Better
49,,I've never been happier for Netflix's 'skip intro' button than I am when I'm watching Star Trek: Enterprise.
50,,LEGO Captain Picard
51,"I know that once upon a time all 10 of the regular timeline movies were on Hulu but now all they have is Nemisis (and you have to have the HBO add-on for that)

I really wanted to watch one of the TNG movies tonight but I don’t know *where* I can do it :/

Does CBS All Access have them?",Is there anywhere that it’s still possible to stream the first 10 movies?
52,"I was wondering what you thought about modernizing tech on a startrek set?

1. Rather than lightglobes, a light can be beamed along a poly-carbonate rod so the rod is the globe passing through multiple rooms.

2. Water can be levitated by sound. This means bathrooms can just be sonic chambers levitating water.

That sort of thing...",What Ideas do you have about Modernizing Technology on a Star Trek Set
53,"Some who watched Voyager may remember them rescuing a few borg kids in the middle of season 6, only for them to be kicked out at the begining of season 7.

But what seems to be forgotten by even the staff, was a baby they also saved on that same ship that just disappeared.

Did they ever explain what happened to the baby borg? I assume they removed the implants.",Sooo about that Borg Baby...
54,,Gaze Into the Eyes of a High Definition Garak in the Deep Space Nine Documentary (First Look at DS9 in HD)
55,"Any more episodes like this across TNG, DS9 or Voyager?  

&amp;#x200B;

Watching TNG for the first time, just finished this episode from season 3. I really enjoyed it for some reason. I think it has to do with the mission eventually clashing with the Prime Directive. (it was cool to see Vulcans reverent of humans for once too lol.)",Who Watches the Watchers
56,,"If you were a member of any alien race depicted in Star Trek (Kingon, Ferengi, etc), which would you be and why?"
57,"Hey guys! 

Big sci fi fan here and I've always watched startrek on and off over the years but never truly binged the series so what to watch in order?


Thanks!",Series to watch in order?
58,"There was a fan made star trek video that was floating around a while back that had a custom star trekkish song recorded over musically appropriate scenes from all the series, even Enterprise. Yeah, thats right. Anyway I want to watch it but I cant find it anywhere! I hope someone knows what I am talking about. Please help. Thanks. ",Looking for a video
59,"Has anyone here picked up the new Kirk or Picard action figures from McFarlane toys? They look fantastic and detailed. Thoughts? What would you want to see if future waves? 

I have both on the way from Amazon. Would love to see a Riker, Data, Spock, Michael, Lorca, Archer and Trip. ",The new McFarlane action figures.
60,"I thought this was a fun thought exercise. Assume that the script stays unchanged, but the set, actors, and filming technologies are within the scope of the new series.

Personally, I'd love to see TOS-era Kirk in The Inner Light. I think it could be portrayed extremely well, and Shatner's S3 over-acting would be pretty interesting, if not powerful. 

In the Blink of an Eye by the Enterprise cast would be neat as well... What if they got caught by the Tachyon field, and were forced to see craft that mimicked TOS or TNG-era ships before their society stabilized the planet and overcame the tachyon field? ","If you could take a Star Trek episode from a series and re-film it with another series' cast, which episode would it be?"
61,"I have a hard time going to re-watch TNG due to figuring an episode out after a couple minutes. I just keep jumping around to find a random episode and it's always something I remember. Which is a good thing, ya know, TNG is amazing! But I want to re-watch some of it without remembering the plot. 

The same goes for DS9 and VOY. I've only seen those episodes once, so it should be easier to find stuff worth a re-watch. But TNG has 2 views from me on most of the episodes. 

So, what are some suggestions on episodes that don't stand out, but are worth a second or third viewing? ",Forgettable episodes that are worth a re-watch?
62,"First I would like to start off I like the premise of Star Trek, exploring the universe meeting new life and trying to live peacefully with them. But with every ALIEN species they meet they all( for the most part) are very humanoid and have human expressions, such as they all smile like humans or they all know how to shake hands. It just bothers me how an alien culture would be so aquatinted with human traditions or body language. One more thing is how majority of the races they come across is humanoids I understand there are some species they show that aren’t but I feel as if they are a minor portion of what they show. 

This being said I’m not trying to attack you personally and your love for your favorite show, I just wanted to voice my thoughts about these series. ",Here’s my problem with Star Trek
