index,text,title
490,"If he knew that her remaining alive in the 1930s would create a future where the Federation did not exist, why not take her into the future instead of letting her die? After all later on he takes Gillian into the future with the whales and nothing in the timeline seemed to have changed majorly.",Why couldn't Kirk take Edith to the 23rd century?
491,"The original Enterprise “no bloody A, B, C, or D” lasted at least 15 years in its original form (the cage to animated series) and then the re-fit gave it about 3 years I think. Then the Enterprise-A lasts from the end of 4 to the end of 6 which is only about 3-5 years (maybe 1 or 2 more til generations). Doesn’t that seem really short compared to the long life span of the original? On Wikipedia it seems especially short compared to the original and the B. Why was it decommissioned so early?",How long did the Enterprise-A last?
492,"Star Trek: Starfleet Academy - Harry Potter in space

Star Trek: Romulan War- Return to Enterprise

Star Trek: New Animated Series - animated version of IDW Comics  Star Trek: New Adventures (Kelvin-verse)

Star Trek: Alpha Centauri:  Gritty and hard knock frontier adventures of Humanity's first interstellar colonial outpost founded by Zefram Cochrane soon after First Contact.

Star Trek:  Temporal Investigations:  Pair of time travelling investigators, Gary Seven and Roberta Lincoln, utilizing the Guardian of Forever

Star Trek Excelsior: Captain Sulu",New Star Trek series pitches
493,"Preface: Dad was a big Trek fan when I was growing up. I was old enough (8 years old) to remember watching the TNG series finale with him. I watched some DS9 then too but overall I wasn't a fan of Trek because I was a child and couldn't understand the storylines. I watched Voyager with him regularly as a teenager. So I watched the Abrams Star Trek movies and got nostalgic for the times I bonded with my dad watching Trek and wanted to take the voyage myself. Found I loved Trek. Watched TOS, then TNG, then DS9. 

It took me a year or so to get through DS9. I liked almost every episode (only ep I truly hate was the one where they're stuck inside the game on season 1), I liked every character. I can't believe how much its series finale is impacting me. Yesterday I hummed the shows theme song at work all day. Just thinking about the ending makes me cry. I can't believe it's over. I can't believe the characters are gone and I'll never be caught up in their lives anymore.

I have a few problems with the finale. Namely, I feel that Damar deserved to live. He should have lived and gave a broadcast to both Cardassia and Bajor to finally build a bridge between their two worlds. To officially seal the end of the old Cardassia (literally) and the birth of a new one. But they killed him and no speech was had. Just Cardassia and its ashes. It's utterly depressing and it amazes me how given how much the show harped on the relationship between the two planets, they neglected to take advantage of showing a bridge between the two nations, in earnest, at last. It's a baffling creative decision and leaves me wanting. Instead, they decided to make a scene at Vic's. 

Besides that, and the fact that Ezri and Julian feels tacked on and forced, I thought the ending was about as good as it could get. 

Right now I'm mourning that I'll never see the characters I love again. Kira, with her strong headed badassery, and her soft spirituality. She may very well be my favorite Star Trek character but I'm still deciding. The woman who was able to let go of her hate for Caradassians and work to help free them. The ending shot of her and Jake looking longingly for Sisko's return broke my heart, but what made me most emotional was Worf. Worf was always my favorite Star Trek character even as far back as when I was a kid. Besides Kira, no other character resonates with me as much as him and he really shined in DS9. So the final shot of him leaving the station looking at the promenade made me cry so hard because I knew it'd be the last time I'd ever seen Worf in Trek and I was forced to say goodbye to someone I've known since I was a child.

I can't believe I'm mourning someone that isn't even real. 

I can't believe it's over. Someone hold me.",Yesterday I finished DS9 after watching for a year. Please mourn with me.
494,,Star Trek Filming Location - The Q Continuum
495,,Screen accurate Star Trek: TNG skants I made for myself and my husband!
496,,OKUDAGRAMS PART 5: UP CLOSE AND PERSONAL WITH DATA'S OPS PANEL
497,,ENTERPRISE 1701-D Bridge Remake | Halo 5 Forge Project (Halo 5 Map Editor)
498,"My wife and I are halfway through TOS, as part of a reviewing of all Star Trek series. I haven’t watched TOS since they were first aired, and the adult me is vexed at the regular references to imperial measures (ex: “the creature was 20 yards away”).

Since I never watched more than a random handful of episodes from the later series, I find myself wondering if - and if so, when - they switch over to using metric measures.",Metric vs. imperial measures
499,"Not sure if this is the right forum to discuss this, but is anyone else underwhelmed or even disappointed with the quality of Eaglemoss’s offerings? 

My first purchase was Defiant, and while it wasn’t as accurate as I could hope it was decent for a $22 toy. I picked up a Steamrunner that was okay, but the nacelles have embedded blue plastic rather than the fully enclosed nacelles I saw in First Contact. 

I gave it one last shot with the Sovereign, especially since so many people online have raved about it. What a letdown. It appears to be the First Contact variant with its extremely light colored finish, but the detailing is absolute rubbish, and some details that should be visible just aren’t there. 

I looked at the XL line but reviews and pictures made me change my mind. The XL Defiant has inaccurate nacelles, the XL Sovereign either has misaligned painted details or just blank hull, and the XL Galaxy looks rubbish to me. 

I think Eaglemoss’s level of detail is okay for very small ships like Defiant and probably the shuttles, but they lack the definition to replicate the bigger ships with any clarity. Out of three purchases, I’m 70% satisfied with one and dissatisfied with the others. 

I would venture though that TOS ships, with their lack of detailing and simpler shapes, would turn out better than TNG/DS9/VOY/Movie ships. ",Underwhelmed by Eaglemoss
500,"[See here, in this screenshot I took from Star Trek Online.](https://i.imgur.com/iGocYFs.png)

Could they be some sort of solar collector? Maybe just to keep the batteries charged?
",I've always wondered what those two blue rectangles below the Main Shuttlebay on the Galaxy class are.
501,"I haven't seen every episode of every series, so maybe I missed one. Just a thought I had last night as I drifted off to sleep, imagining Picard welcoming aboard a delegation of little guys like three inches tall",*trekkie shower thoughts* why no tiny alien species? like minature dudes?
502,,Shazad Latif Talks About Emotional Klingon Return In ‘Star Trek: Discovery’ Season 2
503,"They eject the core, the Caatati steal it, they ambush Voyager and say that they have their warp core, Seven makes the device to replicate Thorium, they say 'thanks,' and then they leave.  No one mentions the warp core ever again.  Sure, we can safely assume it was returned but given it was the central problem of the episode, I'd think they'd have addressed it.","Just rewatched Day of Honor (Voy S4E3) and unless I'm missing something, the writers forgot to address one small detail. They never got their warp core back!"
504,"I've been thinking about running a Star Trek RPG soon, and about the Treaty of Algeron (forbidding the Federation from developing cloak technology), and about the premise of a continuous narrative chain through The Wrath Of Khan, The Search For Spock, The Voyage Home, and The Undiscovered Country (skipping ST5 entirely).

My best recollection is as follows: in TSFs, Kruge was aware of preliminary diplomatic talks between the Klingon and Federation governments, well before the Praxis disaster. And similarly, in TUC, the Romulan Ambassador was present at the Khitomer conference for reasons not made clear in the film itself. 

My understanding is that, since everything else in TSFS flows directly from the aftermath of the Genesis debacle, it follows that the diplomatic efforts Kruge referenced do as well. The Genesis device soon proved to be an utter failure as a terraforming system, but its applicability as a planet-killing weapon was instantly obvious to everyone involved. 

So my conclusion is that the Treaty of Algeron isnt so much that the Romulans can have cloaking technology but the Federation can't; rather that nobody can be allowed to have both the capacity to create a Genesis device and the capacity to deploy it under cloak to an enemy world. Each of the political powers on the galactic stage can have one or the other, but if anybody tries to have both, then everyone else unites to obliterate them. 

Seen in this not-necessarily-canon light, the Romulan Commander Taris in TNG: Contagion, insisting that the Federation could not be allowed to gain control of Iconian Gateway technology... starts to look a lot less villainously nationalistic. 

So, anybody spot any flaws in my recollection?",Please check the historical accuracy of my vague recollection of the Kirk films?
505,"My wife and a co-worker are having a dispute about the morality of Janeway's decision regarding Tuvix.  My wife believes that the wrong choice was made.

She thought it'd be cute to make a politically-charged shirt button to wear at the office and asked for my help.  I found a website that allows custom designs, and I whipped this thing up. 

https://i.imgur.com/ZnkBeYW.jpg

It was the crappiest, lowest-resolution picture of Tuvix that I could find.  She *hates* it.  

I bought it.  Her co-worker thinks it's hilarious.  Thought I'd share.  (For what it's worth, I agree with my wife about Janeway's decision)  My order will show up in two weeks after I'll have forgotten all about it, which is awesome.","Ever wanted to wear a button on your shirt to show that you disapprove of what happened to Tuvix? Me neither! My wife did, though..."
506,,What if there's no escape pod left for Chief O'Brien?
507,,I finally made it to Star Fleet Academy.
508,"Only caught the random DS9 and Voyager mostly back as a kid, but I heard that TNG was even better.

So I saw the first two episodes. Farpoint was good, if a bit quirky and slow-paced.

But, S1E2, The Naked Now, has really put me off.

I'll forgive the one-dimensional 'everyone gets drunk and now almost everyone just wants to screw each other.' Only a handful actually do *other* drunk things. It's dumb but fine. Must be a lot of tension being stuck on a ship forever, even if it was shown in the pilot the enterprise is actually pretty big. Maybe Starfleet don't allow crew to have formal relationships?

I had also expected Wesley to be a problem, it's a bit of a meme. But this trope of 'bumbling idiot endangers the cast and gets rewarded' really gets to me.

Wesley, a child civilian, starts a mutiny, assumes command of Engineering, couldn't care less the ship was being taken apart right next to him, and finally, instead of being thrown in the brig as a timeout, he's *rewarded* for buying a few extra seconds for someone else to fix his problem?

Please tell me that this isn't a common occurrence. Or at least a list of the episodes where that trope exists, so I can avoid them like the plague.

Edit: Thanks for your comments guys. Continuing on with season one. Just now with copious amounts of alcohol and the suspension of disbelief that this isn't actually just a series of old cheesy B-films until Riker gets that beard.",[TNG] Does it get better than the bad first impression?
509,"https://i.imgur.com/uDtmuNp.jpg

As someone else already posted, the Disco LPs (Lakeshore Records) are finally arriving. In addition, I also have the Wrath of Khan set from MondoTees and The Motion Picture from La La Land Records. All of them include 2 discs. Which one do you like the most? ",My growing collection of tie-dyed Star Trek vinyl records
510,"Hey I figured this would be the place to ask and because I joke about it everytime I watch this episode. What are some thoughts on what happened to the Borg baby that 7of9 saved in the VOG episode ""Collective"" we constantly know what's going on with the other borg children she saved. But we never hear or see anything about the baby again. Not even later on in the series they start returning the other Borg children to their home planets. ",What happened to the Borg Baby 7of9 saved
511,"Picard - “What I’m going to say may sound unscientific, but standing on this soil, breathing in this air, my instincts tell me that we may have got them wrong.”
Worf- “But we do know the Iconians were conquerors.”
Picard-“ But that knowledge was passed down by the descendants of those who attacked this world. The victors invariably write the history to their own advantage.” 
Picard- “There is an unfortunate tendency in many cultures to fear what they do not understand.”",S2: E11 - Jean-Luc Picard talking to Worf and Data about the Iconians.
512,"image recap: [https://imgur.com/a/5k7Qeau](https://imgur.com/a/5k7Qeau)

review:   [http://chrysreviews.com/?p=430 ](https://t.co/Wmz8phr7sd) 

full season of Discovery Recaps: [http://chrysreviews.com/index.php/star-trek/](http://chrysreviews.com/index.php/star-trek/)","tl;dw ToS Season 1, Episode 22 Recap: Sleeping Beauty"
513,SPOILER The origin of the Borg? Wow. What did you guys think about how it was done?,"So I read the Star Trek Destiny series. Slow start but, holy crap."
514,,Deanna Troi Honors the 346th Anniversary of the Death of Legend Aretha Franklin &lt;3
515,Maybe I'm remembering this wrong but I think there were rumours during DS9's run of Leonard Nimoy appearing. The plan was to reprise Mirror Universe Spock. Nimoy said he'd only do it if he could have the beard. It makes me wonder what else would have been cool. More Thomas Riker on DS9? A passing of the baton scene from T'Pol in DIS? Admiral Archer in Star Trek 2009?,"What character crossover would you have liked to have seen, for example Spock in DS9?"
516,"My pictures really don't do them justice!

https://imgur.com/a/EYb9lgA",Star Trek: Discovery soundtrack records came today. They look and sound beautiful!
517,"fan theory. Ok not fan, me. ",Is O'Brien [DS9/TNG] a homage to Kyle [TOS]
518,This was one of the most satisfying books I’ve ever read. An amazing adventure across centuries. ,"I just finished reading the Star Trek Destiny trilogy, and I can’t stop smiling :)"
519,,"Inside the U.S.S. Equinox NCC-72381: A Nova-class science vessel. At a length of around 222 meters long, 8 decks, and a crew of 78, the ship was relatively small compared to other ships of the time."
520,"I will admit, although I like the show so far, I haven't had a huge urge to watch the season as a whole again and haven't yet. 

In fact I realized that a lot of the season just wasn't very repeatable and because I just wasn't very compelled to watching the Klingon War stuff but that is literally 2/3rds of the season. And because its so serialized it makes it hard to just pick out an episode and watch it on it's own. But maybe others feel differently. 

But for me, I have only watched four episodes twice thus far. They are:

-The Vulcan Hello (being first and all)

-Context is for Kings

-Magic to Make the Sanest Man Go Insane (and easily my favorite for the season)

-Lethe (literally just watched this a second time a few days ago and gave me the ideas for this thread)

But that's been it so far. I been thinking to rewatch the first MU episode as it was very good IMO but haven't done it yet. What's funny is I was excited about the show being on AA because its the first Trek show you can just watch over and over again without recording it. But haven't done it.

Anyway what have other people rewatched and why? Or has anyone rewatched the entire season? Or haven't watched anything again? I'll probably rewatch first season as we get closer to season 2 but so far little interest.

",Which Discovery episodes have you watched more than once?
521,"Q: Life is but a walking shadow, a poor player that struts and frets his hour upon the stage and then is heard no more. It is a tale told by an idiot, full of sound and fury, signifying nothing.

PICARD: I see. So how we respond to a game tells you more about us than our real life, this tale told by an idiot? Interesting, Q.

Q: Oh, thank you very much. I'm glad you enjoyed it. Perhaps maybe a little Hamlet?

PICARD: Oh, no. I know Hamlet. And what he might said with irony, I say with conviction: What a piece of work is man. How noble in reason. How infinite in faculty. In form, in moving, how express and admirable. In action, how like an angel. In apprehension, how like a god.

Q: Surely you don't really see your species like that, do you?

PICARD: I see us one day becoming that, Q. Is it that what concerns you?

\*Q Rage Quits\*",Your daily quote from Captain Picard
522,"She's googled this, of course, but would like some hard-core trekkies to confirm 100% that she's got the right image before permanently inking it in.

Thanks in advance for your help!","Help! Wife wants ""Live Long and Prosper"" tattoo in Vulcan script...where can she verify 100% that an image online is accurate?"
523,"Ahoy hoy fellow Trekkies and Trekkers! 

We've decided to run a little experiment this week. As our sub has grown and grown over the last year (at the moment we're averaging around 100 new subscribers a day!), we've started to feel like it's become less like a community and more like a bunch of strangers getting together to talk about something they're interested in. Which is fine, but we'd like to bring back a bit of that family feeling and get to know each other a bit better. 

So we will be trying out having an ""off topic"" post, pinned to the top of the sub for a day or so every week, where users can gather, have a tall glass of prune juice or Romulan Ale, and talk about how things are going and what you're doing/looking forward to/cooking/playing/watching. Depending on how it goes and the schedules for the new Trek shows, it might move around the week a bit (and because Ten Forward Tuesday sounds better tbh).

-------------------------------------------

**Ten Forward Rules**

* No politics! While we appreciate that this is a topic on everyone's minds in one way or another, for now we'd like to not have to sit and fight fires in this thread. This rule might change in the future but for the moment please don't directly discuss politics here.

* Non-Trek related talk is encouraged! Feel free to discuss your other favorite sci fi shows, your awesome new sneakers, share photos of your dog, etc. While we won't be policing the thread, if you do want to talk about Trek it's probably better to do that elsewhere in the sub.

* No memes/shitposting. That's what /r/risa is for.

* Wheaton's Law applies, of course. Don't be a dick.

---------------------------------------------

**This week's topic:** introductions! Feel free to introduce yourself and tell us how you got into Trek and what else you're into right now. Is there a video game or a TV show you're addicted to? A book you can't put down? What's revving your engine this week?",Ten Forward Thursday [8/16]
524,"What are your guys’ thoughts on the best thing to show to someone to introduce them to Star Trek (we’re talking college age here) 

The new movies, an older movie (maybe the motion picture or something) or an episode of one of the TV shows? I could see any of these being arguably the best thing to start with, but I’m looking for something to hook them and not just be the “best” thing to start with. ",How to introduce friends to Star Trek
525,What do you want most for Season 2??? We have a Spock and Tig is in it.,Season 2
526,"Do you want a Star Trek film with Chris Hemsworth returning as George Kirk?



Please take [this poll](https://strawpoll.com/sh88c8hf).",Do you want a Star Trek film with Chris Hemsworth returning as George Kirk?
527,,Why axing Chris Pine would be a very bad idea for the Star Trek films
528,"I attended a few Creation Conventions in Pittsburgh in the late 80's (1987 to maybe even as late as 1990) and I'm trying to find the exact dates. Three separate conventions, guests were, Nichelle Nichols, Michael Dorn, John DeLancy.","Trying to find specific dates to Creation Conventions in Pittsburgh, late 80's."
529,"Hey guys, have just about come to the end of the voyager series, to be honest the first Star Trek I’ve watched.  I wouldn’t call us hardcore fans but the misses and I really enjoyed it. The question is where do we go from here? I see deep space nine, next generation, enterprise, and straight Star Trek on Netflix. Where do I head from here for best viewing, not too worried about following in order or anything like that?   Sorry if it’s a stupid question, but there’s only so long we can drag the last 3 episodes out for! ",Maybe a stupid question!
530,"I've made several posts in the past about making my way through the Star Trek canon and recently I finished Deep Space Nine on my first run through. It is, by far, my favorite incarnation of Star Trek and I was truly sad to see it go. 

Once I finished DS9 I moved on to Voyager. Whenever I made posts previously, Voyager always seemed to get a lot less love than other versions of Star Trek. Some even cautioned me to avoid it altogether. Well, Voyager's first season is only 15 episodes so it has been going by pretty quickly. Today I finished season one and honestly I can't yet see why people disliked it. 

There are some things that immediately stand out as being a stretch...first off, the crew seemed to take the whole 70,000 light years and 75 years to get home pretty easily in the early episodes. I'd imagine if something like that happened in real life, there probably would have been a mutiny of some kind with Maquis personnel desperately trying to overthrow the Starfleet personnel aboard the ship. Further, Janeway seems to put a lot of trust in Chokotay despite having previously been in hot pursuit of him as a Maquis traitor. Making him her first officer and then immediately giving him all her trust seemed....fool hearty. I get that over time they would develop a good working relationship and she'd grow to respect and value his counsel but within the first 2 episodes everyone seems too.....chummy. 

That being said, this is more like TNG than I think I had thought it would be. They are exploring, meeting new species, getting into trouble, getting out of said trouble....it really reminds me of TNG in a lot of ways. Storylines don't seem to have the length or consequence that they did in DS9 and at least thus far I can't tell if there will be any major character arcs that will take place because there really hasn't been much previews of that thus far. 

I like Kate Mulgrew and I like Captain Janeway. Sure she's no Sisko....or Picard for that matter but so far, she's made decisions in all the ways I'd expect a Federation captain would despite their circumstances. Hopefully I'll grow to like her more as the series continues but I doubt she'll ever vie for my top spot which is currently a very close tie between Sisko and Picard (with Kirk as a close second). 

Anyway - just wanted to share my experiences so far. ",I just finished Season 1 of Voyager and I don't get the hate this show sometimes gets
531,"It seems odd, in a film so centrally about Data and about his relationship with Picard, that the whole story would just treat him as an emotionless android. In fact, there's even a line where he says something akin to, ""I don't feel"". 

That's not true!  Generations and First Contact went to great lengths to establish Data's emotions, and even if Insurrection mostly ignored it (by writing the Emotion Chip out of the story in the opening scene), it at least was aware.

I've always found this so weird about Nemesis. Especially since Spiner co-wrote.",Why did Nemesis forget about Data's Emotion Chip?
532,"A while ago I saw some YouTube videos by someone who I will refrain from naming as to not shame them. In their videos, they talk about Trek lore. And I've noticed a serious disdain for Discovery and the fans of that series. He loves to be sarcastic about the flaws of the show, the Vulcan/Klingon first contact part especially. Yet he shrugs off other inconsistencies of equal merit and tries to reconcile them rather than mock them.

So this got me thinking. How important is continuity in this franchise? After all, there are a great number of inconsistencies of varying degrees of scale. Phasers supposedly able to obliterate planets, yet I can't recall them ever using more than a sliver of that power anywhere. Even during wartime when it would be justified. Then there's Voyagers ""limited"" torpedo supply, Picard not showing any real adverse effects to assimilation unless it suits the plot, solutions to problems never being mentioned again, I could go on and on.

And yeah, you could reconcile these, but so could you with the cracks in Discovery. It's hypocritical to throw those under the bus while brushing aside the rest. Trek has ALWAYS had errors in continuity. And personally, I can accept it. Past, present and future. I may make fun of them at times, but in the end, I feel they are part of Trek. And so I learn to live with them. And reconcile when I can.

Man... I went off on a bit of a rant...

",Thoughts on Trek continuity
533,,"Searching for Spock, and the issue of recasting..."
534,,"""The Oldest Nerd"" on Ethan Peck's Cast as Spock on Star Trek Discovery"
