index,text,title
264,"Like when you're watching these type of episodes you know you're gonna have a good time?

Examples include 

* Holodeck episodes
* Ferengi episodes 
* Klingon episodes 
* Cardassian episodes 
* Time traveling episodes
* Pre-warp civilization episodes
* First contact episodes

My favorite episodes are whenever the crew goes to a pre-warp civilization and something happens that they have to bullshit their way into explaining why aliens with incredible tech are on their planet.",What's your favorite type of star trek episode?
265,"Okay this is going into the holodeck which is just a whole kettle of cans of worms, but I had a thought.

We know Neelix was given a set of temporary holo-lungs. We know that people eat/drink and possibly even choke on smoke. So we know the replication of holo products is almost perfect.

Now taking inspiration from that weird line in ""blink of an Eye"", imagine a future where, a Woman lost her husband before they had kids, and she had sex with a holo-representation of her husband.

Now obviously everything about him is a holorecreation, but! Say she conceived in the holodeck and stayed in there for most, if not all, of the term. Assuming she only ate food from outside the holoeck her body would create a child using both her own and a holo-representation of her husbands DNA.

Now this child, would only have 1/2 of a cells worth of DNA that was now Holographic. The rest would have been made by the mother based on the original, due to cellular Mitosis.

Now say the woman steps out of the Holodeck with her child, it might suffer very slight cell death in a few hundred cells. But a baby is still developing and can compensate for that (not to mention future medical tech)

So the result would be a 100% organic child, from a mother and a holo-father.

Your thoughts?",Holo-kids Could they work?
266,"With tech from the future, ie: mobile emitter, borg hybrids ect.. even 7 of 9 is the smartest human in history, it would change the timeline upsetting the balance of power with the federation being overpowered. Is this why they did a reboot?  Erase the voyager timeline? In Nemesis We see admiral janeway, so why doesn't the enterprise have transwarp, borg reactive armor, and other future tech brought back by voyager? with the reboot all that goes away. Thoughts?",Did the Voyager timeline just get silly? Did the reboot erase the voyager timeline?
267,Got it on humble bundle. The first one to comment gets it,Star Trek Online - Humble Trekkie Pack key giveaway
268,"How come it was illegal for The Pegasus to have a cloaking device, but it's perfectly kosher for The Defiant?

Because the Federation developed the gadget for The Pegasus? Was The Defiant's cloaking device a gift from the Klingon Empire?",The Pegasus vs. The Defiant
269,,Making my way through TNG. Diggin it. Planning on watching the rest. What’s the timeline of all the other Star Trek shows? What order should they be watched?
270,I just watched the TOS episode shore leave.  Now that would be a great place to take a vacation.  That would be even better then Risa.  And I didn't think anything was better then Risa.  ,Shore leave
271,,Enterprise intro with Archer's Theme
272,,John Cho Awaiting Paramount’s Decision For ‘Star Trek 4’ + Kevin Smith Weighs In On The Chris Crisis
273,,Does anyone have an in-universe chronological order for the Trek novel-verse??!
274,"That seems like a concept rife with possibility. And as an officer, he's probably compelled to take his fleet-mandated six weeks of vacation a year","One hundred seventy-seven episodes of TNG, and we never got one episode about Data on vacation"
275,"Just want to clarify, I am on Season 5 of TNG and I love it, however, I have to admit I wish there was more planet/alien exploration and observation. That was one of my favorite components of TOS and it seemed to have a lot more of that compared to TNG.  (or am I misremembering?)",Working my way through TNG for the first time. Slightly disappointed in the lack of exploration of planets and civilizations.
276,"Here's mine and a copy/paste below if you need:

Captain: sisko - punched Q square in mouth. Half wormhole alien

First officer: Next Gen riker - there are chairs that need to be stepped over

Tactical: DS9 worf - ""find him and kill him!""

Science: data - need some sherlock episodes!

Security: tuvok because vulcan death grip

Medical: Voyager emh - walking medical library and singing skills

Engineer: o brien - veteran war time engineer

Helm: 7 of 9 - need someone who can take data out when hes acting up

Coms: kira nerys - need a militia veteran

In the brig: Garack - can do the dirty work for us

In the bar: quark because we all cant be good guys

Ambassador: a very dead neelix because he died tragically in cooking accident

Ship: next gen enterprise which never leaves docking station- (because its essentially a sitcom anyway)

For ease of use -
Captain:
First officer:
Tactical:
Science:
Security:
Medical:
Engineer: 
Helm: 
Coms: 
In the brig: 
In the bar: 
Ambassador: 
Ship:","One more time for the laughs - what's your dream team star trek crew, ship and a brief why?"
277,,Remind anyone of Zefram Cochrane?
278,"So we know from the DS9 episode “Accession” that if a planet has a caste system of any kind, it is considered ineligible for membership to the federation. So what do you think happens to planets that meet all the technological and political requirements, but still discriminate against certain members of its population?




Let’s use the Vissians as an example. Their only appearance in the franchise was in the Enterprise episode “Cogenitor.” I’ve brought this episode up before, mainly because it infuriates me to no end (which might become apparent here.) I’m going to assume you’ve already seen the episode and are familiar with its contents. After watching it recently, I couldn’t help but wonder what would happen if the Vissians later applied for membership in the federation.




Imagine you’re a Vissian. Your civilization has practiced a form a sexual slavery for as long as your history records. It’s so accepted on your planet that no one ever questions it. One day, your planet’s government applies for membership into the Federation of Planets, the most powerful organization in the Alpha **and** Beta quadrants, with solid footholds in Delta and Gamma. Membership means security for your people, both on and off-world, a voice in galactic affairs, and access to the combined knowledge of thousands of unique civilizations.


Then it gets rejected.


And the reason why is made perfectly clear. The federation finds your treatment of the Cogenitors backwards and barbaric. Maybe they don’t say it like that, but they say it. So what does the average Vissian think now? Quintillion’s of people all looked at your society and said without hesitation “that’s backwards, barbaric, and wrong.” Does that give you pause?




The closest real life example of what I’m trying to describe would be apartheid. Most of the countries on earth utterly condemned what the South African government was doing to its black citizens. I’ve wondered before what it was like to be a supporter of apartheid at that time. The entire rest of the planet is telling you you’re the bad guy, how can you go on thinking that what you’re doing is right?



I’m sorry, this turned into another rant about an episode I’ve already ranted about multiple times. But at least this time, I’ve asked a question that I hope people on this this sub will find somewhat interesting.","I’m really sorry, but I have to rant about “Cogenitor” again..."
279,"I was rewatching TNG ""Darmok"" recently, where they mention that the Tamarians were first encountered by Starfleet about 100 years ago. It occurred to me that Discovery is right around that time period.

So, maybe Discovery could do an episode about First Contact with these guys?

But wait... that doesn't actually sound like fun. Nothing really exciting happened at the time, after all. They failed to crack the code of their language, nor was there any mention of a conflict. How would they give us an interesting episode without violating canon?

You make it the B plot, that's how. Put the focus of the episode on something else: crew relationships, recent events, some mundane problem that serves as a substrate for character development. First contact is one of those things that's seen as a big deal and they make whole episodes revolving around the clash of cultures and so on, but I find something amusingly appealing about doing a first contact episode where it's treated as just another day at the office. They spend a few hours trying to get to know these bizarre aliens who love their proper nouns so much, but eventually have to just give up before they say something offensive. Shaka, when the walls fell.

That would all be in the background. Most of the screen time would be about, I don't know, Burnham and Tilly debugging the translator and musing about the vagaries of life in space. I think it could really work as a breather episode. You know the kind I mean, like ""Captain's Holiday"" or ""In The Cards"". Something lighthearted to break up the more serious episodes.

I think it's a fun idea that I just wanted to share so everyone else can share in my disappointment when it never happens.",Tamarians in Discovery. Think it could work?
280,,What was the 'Probe' talking to the whales about?
281,"[https://www.northeasttrekcon.com/](https://www.northeasttrekcon.com/)

Our second Star Trek convention since 2016, the  Star Trek Association of the Northeast brings to you ***Northeast Trek Con 2018*** held at the Albany Capital Center in Albany, NY Oct 26-28.

We have Chase Masterson, Jeffrey Combs, JG Hertzler, Robert O'Reilly, Aron Eisenberg, Larry ""Dr. Trek"" Nemecek - and we will be announcing a minimum of 3 more Star Trek actors!!!  We also will be announcing new events, new ticket types, and new photo options in the next few weeks.

​

Come join us for a fun-filled weekend of Star Trek, science + science fiction.  [🖖](https://emojipedia.org/raised-hand-with-part-between-middle-and-ring-fingers/)",Star Trek Convention in the Northeast - Oct 26-28
282,"As much as I love TOS, as much as I love TOS's unique aesthetic style that no other series has attempted to mimic (even when it really should), TOS just doesn't fit anymore.

Aesthetics aside, TOS has aged horribly on social issues. Yes, it was extremely progressive for its time *race wise* but its treatment of women was still rather appalling -- and note that TNG, DS9, even VOY and ENT also suffered from this in some respect. And to say that the Federation of TOS could even possibly be just 10 years after the significantly more progressive Federation of Discovery would be utterly insane.

Moving on from socio-political issues, TOS (and its sequel, TAS) also diverges from the rest of Trek canon significantly in many places. In ""Balance of Terror"" the Enterprise seems to fire phasers like torpedoes, and apparently requires a special ""Phaser Control"" room where crew members fire the weapons manually. Given that we see nothing like this in ENT, DIS, or anything that comes after TOS, this is a technical inconsistency. At another point, the Enterprise travels 1,000 lightyears at ordinary warp within just a few days -- Voyager could've gotten home much faster if that's how fast the *original* Enterprise could go. And there are many more that I could list but I want to avoid making a novel out of this.

Now, moving on to aesthetic issues. As much as I love the TOS aesthetic and think DIS should have respected it more, it should be noted that this aesthetic provides one of the biggest eyebrow-raising issues in all of TOS: Everything looks the same.
It would be one thing if the memorable TOS style was unique to Starfleet ships, but we see over the course of the series that Klingon ships, Romulan ships, ""Alien of the week"" ships, and even ancient human vessels like the Botany Bay all follow this aesthetic -- even though these are all vastly different cultures and situations behind construction, how do they look the same? That, along with the fact that many of the races we would later see in TNG and ENT appear in the stereotypical TOS makeup, even though later on the Klingons *and* Romulans would get their forehead ridges.
What this shows is that TOS doesn't really take itself seriously in many ways. We're supposed to suspect our disbelief that the aliens look like humans in light makeup and that all the interior scenes are made using recycled props and re-dressed sets and thus all look like they were built by the same race. And we're supposed to just ignore the countless glaring continuity errors, events that contradict later canon, and stories that should never have been written at all (Spock's Brain, anyone?). Within the larger scheme of the Star Trek cinematic universe, TOS is a trainwreck of errors that, though charming in its dated nature, and sentimentally valuable to fans, is doing more harm than good overall.

So here's what I suppose: CBS should declare the Original Series and its animated Spinoff to be in an alternate timeline of its own. Then they should reboot TOS as a modern show, they could pick out things to keep, and things to leave behind. Famous *good* episodes could be redone from the original script with only slight tweaks to fit better in canon, fix any politically ""sketchy"" material, and use the modern budget and effects to more closely achieve the original writer's original intentions for the episode (which they usually had to cut down), meaning we could have episodes like ""Balance of Terror"" ""City on the Edge of Forever"" ""The Trouble with Tribbles"" and ""All our Yesterdays"" redone with stunningly beautiful sets and effects, and vastly more expansive scopes. Stories that could've been good or were good, but were written poorly, could be thus rewritten to achieve their true potential. As well as entirely new episodes to replace the ones that are completely irretrievable -- imagine replacing ""Turnabout Intruder"" with something awesome. And let's not forget that TAS, too, had some good episodes. Those episodes could be remade in stunningly beautiful live-action.

This sort of change wouldn't be for everyone, of course. There are a lot of TOS purists who would rather have *everything else* declared non-canon so TOS could shine on its own. But I think that, by placing TOS and TAS in their own alternate timeline, CBS could ensure that both original shows remain canon, but separately from the rest -- this, I hope, would satisfy both sides of the aisle.

There would, still, be some issues reconciling such a change with larger Trek canon. As shows like ""Relics"", ""Trials and Tribble-ations"", and ""In a Mirror Darkly"" all feature TOS heavily. But it is possible that modern VFX could edit each one to fit the rebooted show, and that the updated version could come out with, say, a 60th anniversary remaster -- note that this would mean TNG, DS9, and ENT would all be getting remastered.

On a final note, such a rebooted show need not start with Kirk. We could instead start with a remake of ""The Cage"" and go for a few seasons of Anson Mount's Pike before making the switch to Kirk -- this would, I imagine, cool the tempers of some fans by letting them get into the show while it was covering unexplored territory, which would make it easier for them to accept the eventually paving-over of TOS. Perhaps a seven-season run would be good -- two seasons for Pike's command, the episodes spread out over a long time span and another five for Kirk's famous Five Year Mission.

Anyway, what do you think? Should TOS be separated from Prime Canon? Would you watch such a reboot show? Do you think CBS would make a good show out of the reboot, Or would they fudge it terribly?

Edit: Well, the DIS hate here is rather astonishing. And the fact that, when faced with glaring inconsistencies in a story, everybody goes ""who cares, it's fictional"" is very disappointing to me as an amateur writer. If these people wrote TV shows, there would probably be no continuity at all.

Also, I must further remind you people that I'm talking about giving TOS it's own timeline to live in, separate from TNG. By doing this, you instantly resolve most of the inconsistencies in Trek canon without removing anything from canon. TOS remains canon, but in the same way that the Kelvin timeline is canon -- perhaps even with a point of divergence established. It also opens up the chance for us to relive some of the better moments of TOS with superior effects and improved production quality via the remake.","It's sad, but TOS needs to go in order for Trek canon to fit more smoothly."
283,,Star Trek showerthought: John Torres must have been a huge SM freak
284,"Let me pose a hypothetical question. 

Can Data be cloned?

Let's say I were to take the basic Star Trek transporter technology and combine it with their replicator technology to create a machine that can clone any object. Put an item in the transporter and it gets transported from one pad to another. The object is turned into a massive amount of data in the pattern buffer. That data is sent to the other pad where the transporter rematerialized the item. 

At the same time, what if that same information in the pattern buffer was sent to a replicator? The replicator uses the information to create that same object. And there you go, you have an original sitting on the transporter pad and a replica sitting in the replicator.

Now who knows if you could use such a theoretical machine on a person. Whatever comes out of the replicator might be a living breathing person...or it could be a lifeless pile of organic tissue. That's a discussion for another time, but what about Data? 

He's a machine. So whatever comes out of the replicator, would be an exact clone. Either it could be an exact duplicate with all of data's memories in tact, or it would be a technical replica only. A completely clean, brand new positronic brain that is ready to either be dissected so they could figure out how it works, or ready to be programmed with a new personality. ""An android on every ship"" as they wanted in the episode where Data was declared a sentient being. 

Do you think Data could/should have been cloned?",Can Data be cloned?
285,"Hey there I am new to the Fandom and only started watching TOS ( I'm currently watching s02e26 “assignment: erath” ) and wondered how the space time functions. I mean how much time is one ""day"" (in lack of better understanding) or 0,1? ",How does Space time function?
286,"Ahoy hoy fellow Trekkies and Trekkers!

We've decided to run a little experiment. As our sub has grown and grown over the last year (at the moment we're averaging around 100 new subscribers a day!), we've started to feel like it's become less like a community and more like a bunch of strangers getting together to talk about something they're interested in. Which is fine, but we'd like to bring back a bit of that family feeling and get to know each other a bit better.

So we will be trying out having an ""off topic"" post, pinned to the top of the sub for a day or so every week, where users can gather, have a tall glass of prune juice or Romulan Ale, and talk about how things are going and what you're doing/looking forward to/cooking/playing/watching. Depending on how it goes and the schedules for the new Trek shows, it might move around the week a bit (and because Ten Forward Tuesday sounds better tbh).

--------------------------

**Ten Forward Rules**

* No politics! While we appreciate that this is a topic on everyone's minds in one way or another, for now we'd like to not have to sit and fight fires in this thread. This rule might change in the future but for the moment please don't directly discuss politics here.

* Non-Trek related talk is encouraged! Feel free to discuss your other favorite sci fi shows, your awesome new sneakers, share photos of your dog, etc. While we won't be policing the thread, if you do want to talk about Trek it's probably better to do that elsewhere in the sub.

* No memes/shitposting. That's what /r/risa is for.

* Wheaton's Law applies, of course. Don't be a dick.

----------------------

**This week's topic:** what's going on this weekend? Do you have any exciting plans? Catching up with Netflix on the couch or heading out to see what's going on in the world? Let us know!",Ten Forward Friday [8/24]
287,"I've never bothered to watch Enterprise before as I heard it was the worst series and the theme music did my head in.  However with little to watch on Netflix, I gave it try number 5.

And boy was I stupid.  I love this series.  Just on season 1 episode 18ish at the moment but so much about it is great.  The pre Federation Starfleet,  the submarine like design of the ship, dealing with recoil when they fired their first laser cannon, a story stretched across a season,  the experienced Boomers vs inexperienced Starfleet dynamic, the Vulcan perspective.   Even the characters - Archer is a brilliant captain.  He's moral but unsure about it, curious but cautious, desperate to prove himself and his species to the galaxy.  Wildly entertaining and highly relatable.  The Doctor is a charming character as are Trip and Malcolm in their own way.  Lewis seems to be the Wesley or Harry of this series but I can handle that.  And some of the T'Pal scenes seem sexually exploitative.

Can't believe I never gave it a try.  It really feels like you're watching historic events unfold.  Really surprised by the quality.",Shocked by how good ENT is
288,"I've been watching [videos](https://www.youtube.com/watch?v=bYK6z9ztNuk) about Stage 9, the absurdly faithful videogame recreation of the Enterprise-D. Most of the sets are very familiar, but then there's [this](https://www.pcauthority.com.au/news/this-enterprise-d-walkthrough-could-be-the-reason-vr-was-invented-409487). While impressive and beautiful, I can't ever recall seeing this set anywhere on the show! Am I crazy? I don't remember ever seeing any shuttlebay other than [this one](https://vignette.wikia.nocookie.net/memoryalpha/images/0/0b/GalaxyShuttlebay.jpg/revision/latest?cb=20121209202934&amp;path-prefix=en). The hosts don't seem to be as surprised as I am by this GIANT-ASS SHUTTLEBAY that we've never seen, which suggests that I'm just not remembering when we've seen it?","When do we ever see the Enterprise-D's ""Main Shuttlebay""?"
289,"This is directed towards people who are fluent in TOS-lore when it comes to novels. 

I remember reading several years ago of a disgruntled writer who criticized another writer (or was the person an editor?) because this person envisioned Kirk as being basically a god capable of defeating several Romulans in hand to hand combat. But I can not remember the name of the persons involved or the novel in which such situation is depicted. 

Any help?",Help me remember: Kirk fist-fighting several Romulans (book)
290,,Behr wanted DS9 to be a dream
291,,"I would have really loved to have seen a Deep Space Nine movie. I know they’re making a documentary, but I’m talking about an actual movie."
292,,Chief O'Brien escapes from the Enterprise.
293,That's all I have to say.,They'd godDAMN better pay Whoopi Goldberg whatever she wants and get her in the new Picard series.
294,,Who is your favorite main cast character (aside from the lead) from each series?
295,"IN the movies they say there was WWIII (first contact) and after it was over was Humanity dropped Capitalism in exchange for communism. Does this mean for the future egalitarian society that there will have to be a massive nuclear war where the communist win? Was this the reason why no one speaks french anymore as most of the french were nuked (why Picard has a British accent)?

I just found it funny/ironic that we always look at Star Trek as the great optimistic future when in fact its predicated on the death and loss of a huge swath of humanity and its culture... Its like Trotsky continual revolution coming to fruition.",Question about Star Trek and the Future
296,Details here: http://www.startrek.com/article/discovery-steelbook-available-nov-13,Discovery Season 1 getting a Blu-ray Steelbook
297,"While rewatching this episode I started to wonder if there were any examples of other species, such as the Romulans, discovering a new inhabited world and what their protocol was as far as making contact if the new species had not yet discovered warp travel or any other capability to let them know other intelligent life exists.for reference I've watched TNG, DS9, and VOY. Edit: Se7 ep13, not 3","TNG se7 ep3 Homeward, a question about the prime directive"
298,"TOS has a great first and arguably second season, but a lacklustre third.

TNG has terrible first and second seasons. Yes, there are a few gems, but fifty-two, hour-long episodes is a slog to get through for only a handful of decent ones. Season three to seven, however, are my personal favourite Trek.

DS9 also starts slow yet the first and second seasons are actually watchable. Season three to seven are also amazing Trek and arguably tied with TNG for the best. Duet is my favourite Trek episode of all time.

VOY is fine with some gems. It’s standout seasons are four and five, but the others are still good and perfectly watchable. My favourite part of VOY is Elite Force.

ENT is half and half. The first two seasons are fine with some gems and the final two seasons are great. Just be sure to stop watching at the second to last episode. Terra Prime is a much better finale than These are the Voyages

DSC is also fine. The production value is spectacular and the storytelling is good, but not up to the highs of Trek.",My Opinion on Star Trek
