index,text,title
697,"My answer to that question used to be an unambiguous yes. And I'm not saying its a ""no"" now. Worf drew me into Deep Space Nine. But now that I've watched the early seasons so many times and fallen in love with the characters and the early series dynamic, I have to acknowledge Worf does disrupt that dynamic a bit. Though I like the character and his continued growth I have to wonder if its worth the disruption to other beloved characters and dynamics of the series. I don't know. What do you think? ",Was Worf's inclusion on DS9 an improvement?
698,"I know you're excited to give us the scoop on the newest season, but there is also a pretty large and unfulfilled demand for investigative journalism here. 

I for one would love to understand the overall vision for the show? What audience is it intended to appeal to? What is the intention of their marketing strategy? Do they believe their ideal fan is someone who holds GoT-esque watching parties or someone who rewatches episodes to find current social parallels? Do they believe their fans come back for the Shonda Rhimes-style drama or the Black Mirror-style scifi &amp; ethics? 

Similarly, it would be interesting to know how committed CBS is to Discovery being popular? Surely Discovery is critical to their plans for CBS All Access but does that add additional pressure to the showrunners? How will the that pressure change the show? Should we expect Discovery to target fans of the JJ Abrahms films, nostalgic TOS fans, TNG+spinoff fans, or are they focused on attracting new viewers?

All of these questions would give us a better idea of what CBS wants Discovery to be and where they're trying to take the franchise.

Sincerely,

Jacob

Edit: if you're going to downvote, please at least explain your rationale for downvoting. Thank you!","Dear SciFi journalists,"
699,,Brent Spiner weighs in on new Captain Picard series at FAN EXPO Boston
700,,5 Star Trek The Next Generation Characters Most Likely To Appear In New Picard Series
701,"Spacedock appears to be hundreds of times the size of the USS Enterprise, maybe even more than that.  Many Starships can fit in it at once.

I wonder how many people are aboard Spacedock?  I would think they have no problem accomodating 10,000 at least.

Is there any info on this?","Do we have any idea of how many people live and work on Spacedock, as shown in Star Trek III and other films?"
702,"Edo: The weird planet with orgies

Angel one: The materiarchial society with human survivors from Cargo ship ODIN.

Both these planets doesnt have warp technologies. 

Edit: Can we all just agree TNG's first season is poorly written? ",How did Enterprise made contact with Edo and angel one without violating the prime directive?
703,,Season 2 Classic-Style Titles for Star Trek Discovery
704,"I am hosting a Star Trek pub quiz on Mon 20th August.

There will be both trivia and puzzles.

The quiz is going to be at a lovely little pub in Belgravia, easy to reach with the Piccadilly, Circle, District and Victoria lines.

All entry fees will be donated to Cancer Research UK, which funds life-saving research into the causes, prevention and treatment of cancer.

[The address and directions are here](https://i.imgur.com/Dz7EzWs.jpg), but PM me if  you'd like more info!",Calling all Londoners: Star Trek charity pub quiz!
705,"I've seen a couple of articles that say Chris Pine and Chris Hemsworth have pulled out of negotiations for the next film over a pay dispute. Of course there is still plenty of time and incentive to work everything out, but for the sake of argument, assume that they don't. Would you want to see Kirk recast and the movie go forward, or would you rather not have the movie at all if there's a new Kirk? I'm assuming more people would be upset about no Pine than no Hemsworth as George Kirk doesn't need to be an integral part of the story.",Future of the Kelvinverse
706,,TNG Documentary: Interviews with actors/writers/producers about Season 4
707,"Watched Fistful of Datas and noticed Picard wearing blue (grey?) -- first time in uniform outside of red, as far as I can tell.

Was this ever addressed?   


Image for reference:   
[https://imgur.com/a/WNNJOSy](https://imgur.com/a/WNNJOSy)",Uniform Question
708,,"Michael Dorn, Gates McFadden and Denise Crosby at STLV - 8-3-18"
709,Is there a good website that has (or does anyone have) high quality maps for printing. Looking for either Next Gen or Voyager ,Next Gen maps
710,,'Star Trek' Star Nichelle Nichols Has Dementia
711,,I've just watched the last episode and I feel like I've lost a family. I can't believe it is over. I'll miss the whole crew.
712,"Tasha Year died on that planet by that evil energy demon. 

She was also aboard the Enterprise C and was captured and killed by the Romulins in an alternate timeline. 

Both timelines can not logically coexist. 

If she was aboard the Enterprise C, than none of the enterprise crew should have memory of her being killed by the demon. 

If the demon killed her, than she couldn't have been present at the time to be transported back in time. 

Because the Enterprise C was successfully sent back in time, the alternate timeline of events in which the Klingon empire was whopping the federation's ass didn't actually happen. 

Thus, the events that occurred on the ship in order to send the Enterprise C back also never took place. 

So who helped send the Enterprise C back in time? 

...time can be a very easy thing to screw up if you're not careful with all your details.",A Paradox - Tasha Yar
713,,Jason Isaacs panel at the 2018 Star Trek Convention in Las Vegas
714,"Watching Voyager for the first time and towards the 2nd half of season 4 Torres starts wearing a jacket/sweater thing that conceals her figure. Was this because she was pregnant? If not, anyone know why the uniform switch up?",Voyager question: B’Elanna Torres/Roxann Dawson pregnant in season 4?
715,,Chris Pine and Chris Hemsworth ‘Star Trek 4’ future in doubt as talks fall through
716,"I'm a little bias on the show as i love it. A guy a work with watched TNG and Voyager but didn't get into DS9 as much. What would be a good episode that could get someone interested without giving away too much. The first one i thought of was ""pale moonlight"" but thats got alot going on that he may not catch",Best episode to try to get someone into DS9
717,Physically I mean.  I think Vulcans are stronger but not as durable and I think physically conditioned humans are a fair match but on a racial level where do Klingons stack on raw physical strength,How do klingons stack against humNs vumcans and romulans
718,,S.S. Aurora Class Space Cruisers NCC-C1200 Blueprints
719,"""The USS Relativity,29th century Federation Wells-class starship operated by Starfleet. (timeship) As seen in Voyager""

From watching the Voyager episode I never thought it looked small. Certain video games the ship looks smaller or bigger. 
",How big is the uss relativity?
720,"Hey all, I'm wondering if anyone has a list of Original Series, Animated Series, and Enterprise episodes referenced in Discovery? I wanna rewatch the first season before S2 drops, and I thought it would be fun to incorporate the previous series' episodes that bear upon the events in Discovery. Some of them are obvious - the Mudd episodes, ""The Tholian Web"" and all the MU episodes, ""Journey to Babel"" - but I'm sure I'm missing some. What's your Discovery context rewatch list? ",TOS/TAS and ENT episodes to revisit before DIS rewatch
721,"So, I recently watched Dark Frontier for the first time in years, and at one point, the Borg Queen is outlining a plan to 7, involving assimilating humanity. She brings up an image of a human, and describes the species: ""physiology inefficient, below average cranium capacity, minimum redundant systems, limited regenerative abilities.""

Given that the Borg look for unique species to improve the Collective, and Humans have so many weaknesses, why bother? Why the continued interest in the species, aside from the resistance they offer?",Dark Frontier
722,"In the end of All Good Things, Q is about to whisper the reason the Q is watching him, then Q pauses, and says ""you'll see."" I think that is the reason. Waiting to see if Picard can evolve to think about the big picture. And to see life beyond time and space. Also, morality on a universal scale. Which he does, finally.

The new Picard show should be him as a Q learning to live as an omnipotent being. Guided by Q.","[Theory/TNG/Finale] Q wasn't judging humanity, he was judging Picard because the continuum is considering making Picard a Q."
723,"I'd love to see the entire cast of TNG reunited on screen, however Guinan in particular would be perfect. 


Q, Picard and Guinan have always had a very interesting relationship, and I'd love to see them all interact again. ",It Would Be Wonderful To See Guinan In The New Picard Series
724,"https://m.youtube.com/watch?v=XX--ggBxu0o

Now I’m not a big fan of family guy because I find the humor infantile, but this video is really funny especially when Patrick Stewart pushes wil Wheaton’s head into the van window, you know because Picard was always a dick to Wesley! Lol","You guys ever see when the cast of TNG was on Family Guy? Video included, hilarious"
725,,"STLV18: Ron D. Moore talks Star Trek, Franchise Fatigue, Writing Process, And More"
726,"A couple of days ago (edit: yesterday?!)  I made a post about having just a few remaining episodes of my first run through of DS9. After a challenging day I finally got to sit down and watch the last three episodes today and I gotta say - it tugs at the heart strings knowing this is the end.

Thanks to Plex and Tautulli I was able to go back and look and see when this journey began for me. May 12th is when I started this series after having finished TNG the previous day on May 11th. 

I'm not going to lie it was a bit of a struggle in the early seasons (namely the first two seasons) to stick with it. I felt the show lacked focus and didn't seem to have a goal in mind for what it wanted to be. Oh boy how wrong I was. 

Three months - three months is all it took for DS9 to become my favorite incarnation of Star Trek after nearly 30 years of TNG easily being my favorite. Captains Picard and Sisko are definitely two very different types of leaders, each with their own leadership style and way of looking at their positions of responsibility. Previously I would have said Picard hands down was my favorite Captain with Kirk coming in a very close second. If you were to ask me now, I am not sure I'd be able to answer with certainty who stands as my favorite now.

I love how they wrapped everyone's storylines up. I think the only one who I was surprised at how they ended up was Rom - though to be fair, as Quark said he was the perfect man to lead this new Feringinar. 

I had really hoped Sisko would come back from the temple by the end but I realize why he didn't. 

Bravo....bravo indeed. ",Its over - My first run through of Deep Space 9 is over and I am so sad to see it go
727,"Don't get me wrong, ""Balance of Terror"" is an awesome episode and very much the cornerstone of what became of Romulans during the franchise's history. But at this point it has a giant asterix always hovering besides it, because so many anecdotes from this episode seem to be in disharmony with what was established further down the road in later series' episodes. When Scotty states that the romulan vessel only has ""simple impulse"" that not only flies in the face of its own design (it features two nacelles, even in viewing range of each other), but also what we see a century early in Enterprise where Romulan drone ships clearly are warp-capable. Also when Spock remarks that ""Invisibility is theoretically possible"" it is at least somewhat implied that it has not been notably achieved until then. Not only are there several species in Enterprise, including Romulans, using cloaking technologies, its deployment now is a major plot point in Discovery's first season. Next there is the general observation that neither has anyone in the Federation ever seen a Romulan (and realized it) ""nor was there even ship-to-ship visual communication"" back in the good ol' days of the Romulan War from 2156-60. But there was, at least on side of the Federation predecessors and I don't see why the Romulans should not have had it either. It's a widely used technology during the time as seen in Enterprise. Furthermore it seems highly unlikely that there never was any romulan corpse floatig through space or lying on some ground battlefield and if there was that nobody cared to check what it looked like. And what did the Romulans gain by masking there appearances? If they had revealed themselves it would have spread mistrust within and towards their most powerful and advanced adversary in said war, namely the Vulcans. Everyone in their command structure could have been a Romulan. And it would have probably been even more difficult to determine who really was as it was with the Founders centuries later as there was at least one effective blood extraction test then.

Additionally, the notion that the Romulan Star Empire isolated itself for 106 years (and later again for 53 years) massively hinders all possibly development they could be subjected to. When new stories are in inception more often than not writers remind themselves that they cannot use Romulans in their story as they allegedly were absent from so many timeframes and it would ""break"" canon if they appeared. The second isolationist period in Romulan history from 2311-64 is already softened up a lot by having them fight with the Klingons at numerous times and Starfleet at least one time, Starfleet officer Stefan DeSeve defecting to the Star Empire 2349 because the ""strict moral compass"" they had projected outwards appealed to him and also they, probably the Tal Shiar though, acquire some genetic material of Jean-Luc Picard during those years - and why should they have chosen him especially if they did isolate themselves completely thus limiting the information they would have had about what happened within the Federation to know that he was an important enough figure to replace. So practically this second period is already at least reduced to 2311-40s and in my opinion the years from \~2344 until 2364 should be treated as a time of limited contact and gradual reemergence on side of the Star Empire.

Going back to the first isolationist period in Romulan history between 2160-2266, I propose that it either should be drastically shortened to open up more space for stories to develop Romulans in or also feature a time of limited contact and gradual reemergence beginning in the late 22nd or early 23rd century. As I understand Romulans it is very much in their character to disconnect from others occasionally, especially after suffering defeat or humiliation. But to keep these periods at the extend they were originally intended does nothing for them and also obstructs many storytelling possibilities or shifts those to other species thus leaving Romulans further behind until they eventually become a mere obscurity.

In conclusion, I hope that the writers of Discovery and any future incarnations of the Star Trek franchise disregard the background story established for Romulans in the TOS episode ""Balance of Terror"" even more than it has apparently been, because it would be more beneficial to them as it would be harmful. As much as has been retconned from this particular episode already it would probably be a good idea to also denounce the notion of a 106-year-long isoliationist period in Romulan history between the settings of Enterprise and TOS and in the process shorten and/or soften it up and also other statments like the unfamiliarity with the appearance of Romulans for storytelling purposes. *But what are your thoughts*?","""Balance of Terror"" while successfully establishing Romulans simultaneously hinders their further development since"
728,"I was halfway through this painting when I heard that Picard was coming BACK! I can't freaking wait. 

https://imgur.com/zX7eIGO

",This is what I was doing when I heard Picard was coming back....what Serendipity
729,"So I had an idea that I think would be pretty cool. I hope the show is about Picard doing archaeology on alien ruins. They could feature him discovering relics and fleshing out a story of what life was like for these ancient aliens. So the show would feature an episodic story about an ancient alien world, punctuated by Picard in the present day discovering new relics and adding pieces to the story. They could even have fun cameos from other Trek characters helping Picard in their specific field. 

It would also be interesting if they weaved it into Discovery a little bit and gave us some back story about the Kelpians and other races of that time. Perhaps even explaining the very different appearance of the Klingons from Discovery's time.

What do you guys think? I think it's the only way for a Picard based show to be excellent. I can't imagine him being an Admiral at Starfleet Command, navigating bureaucratic red tape and what not. I feel that would make a boring show, but the archaeology could go any direction, even changing from episode to episode, or perhaps following one species per season in a sweeping story arc like True Detective had done.",Picard's new show idea
730,"No, Q did not alert the Borg to the Federation's presence and abilities (as Captain Janeway once accused/implied), rather he informed the Federation of the Borg's presence and abilities.  More than that, he tricked the Borg into believing that the Federation's technology was far more advanced than it actually was.

In the final episode of STTNG's first season, the Enterprise investigates some colonies with which the Federation has lost contact.  Being close to the Neutral Zone, the crew suspects Romulan involvement.  They find the colonies have literally been wiped from the face of their planets and later find that the same has happened to Romulan outposts near the Neutral Zone.  When, in season 2, Q sends the Enterprise 7000 light years across the galaxy to force a confrontation with the Borg, the first thing the crew finds is a planet that has had all signs of machinery and technology wiped from the surface in the same manner as the Federation colonies near the Neutral Zone (as Data points out).  So the Borg already knew about the Federation, and Humans, and had a pretty good sampling of their technological (although possibly not defensive) capabilities.

The Borg might have, and certainly COULD have, at this point swarmed and completely assimilated the Federation.  However, all of a sudden, a Federation ship appears 7000 light years away from anywhere the Borg would expect them to be.  We know Q is responsible, but for all the Borg know the Enterprise has a propulsion system far beyond anything they themselves have.  They take an immediate interest in the Enterprise and beam into Engineering to conduct thorough scans.  The Borg cannot find an unknown-to-them propulsion system that does not exist.  They are determined to chase down and capture the Enterprise attacking only it's shields as to preserve the ship so that it's secrets can later be assimilated without damage.  Just as quickly as it appeared in their space, however, the Enterprise disappears back into Federation territory!

The sudden apparent ability to travel long distances instantaneously likely caused the Borg to re-think their plans to dominate the Federation.  Rather than full-scale invasion, the Borg would merely send individual ships to continue to probe the Federation and learn it's capabilities in more detail.  Eventually Captain Picard, and other Starfleet captains would be assimilated and the Borg would learn about Q.  They would learn that although apparently troublesome, he was clearly on the side of the Federation and easily able to defeat them.  Thus, they learned to tread very carefully when attempting to attack the Federation.  Furthermore, just 5 or 6 years later.... *BAM* another Federation ship, this time Voyager, appears instantaneously on the other side of the galaxy.  ""Holy SPACE,"" the Borg must have thought... the Federation keeps showing up where they don't appear to be able to reach.  Whether by technology they cannot assimilate, or by help from aliens more powerful than themselves, the Federation apparently had a clear advantage over them that the Borg dared not risk everything to overcome.

By sending the Enterprise into a confrontation with the Borg Q forced the Federation to prepare themselves better, and caused the Borg to second guess their preparedness to invade.  Q knew what he was doing, he was saving his favorite pet!

P.S. The Dominion should've known better.",Q Saved the Federation from the Borg
731,"When you say “Picard to Enterprise,” does everyone on the damn ship hear you? You have to narrow it down a little right?

“Two people and two pieces of equipment to beam up. “They never tag the equipment. And they always just say “equipment.”

Yellow alert is savagely underused. If you see a weird thing you should immediately go into yellow alert. You are in weirdo space. Red alert should follow very soon after. And always raise shields. Just raise the fucking shields.

I’m the captain now. ",Sonic Shower Thoughts (sorry to the guy that cane up with that first)
732,"Poll was here:

https://strawpoll.com/pghsakxw","Picard POLL Result: Do you want Full Older Picard Sequel - 98.41% (62 votes), or Older Picard presents Young Picard Adventures on USS: Reliant - 1.59% (1 vote)"
733,"Last week at The Television Critics Association's summer press tour, Marc Debevoise, president and COO of CBS Interactive, revealed for the first time the actual number of CBS AA subscribers. CBS All Access has [**2.5 million subscribers and its average viewer age is 43**]( https://www.broadcastingcable.com/news/tca-2018-cbs-all-access-has-2-5-million-subscribers)

2.5 million is a small number when you compare it with other major streaming services in the US. Netflix (50 million), Amazon (26 million) and Hulu (17 million). 

Edit: CBS All Access was launched on **October 28, 2014**.",With its small subscriber base (2.5 million ); CBS All Access is limiting the exposure of new Star Trek shows to a wider audience in the United States.
734,"In Voyager’s “Treshold” Tom Paris travels at warp 10, then everyone on Voyager refers to it as “infinite velocity” and claim it can take you anywhere in an instant. However, in TNG’s “All good things” Beverly orders warp 13. If warp 10 is infinite velocity, what is the point of warp 13?",Post warp 10 question
735,"A return to the prime timeline, sometime after the destruction of Romulus. The major powers of the alpha and beta quadrant are all still reeling from one tragedy or another. The near annihilation of Cardassia by the Dominion. The loss of the romulan Senate and subsequent loss of their homeworld. The pounding the federation took from the dominion and Borg. Klingon instability as rival Houses challange Martok and Ambassador Worf. The social revolution upending Ferengi culture. 

In response a more militant star fleet is emerging. It still Boldly Goes, but now carrying a bigger stick. The warship development program started in response to the Borg. Has grown after the dominion war. Star fleet security forces have brought back the MACOs.  

The main antagonists across the seasons would be the Tholians. Their territory is a vast swath  of the alpha quadrant. They've barely been touched upon in the TV series. 

A female andorian will be the captain of the show. A decorated veteran of the dominion war. Her first ship lost in the final battle over cardassia. Now in command of an aging Excellsior class ship. Wrapping up an aid mission in cardassian space, and heading to a starbase for decommissioning. When an urgent encrypted and highest security message comes in for her. 

Section 31 agents that were discovered and being pursued by Federation Intelligence, stole a prototype warship. Detachable hull modules allow this battleship to bring  fighters and troop drop ships, or serve as hospital and refugee transport. FedIntell thinks section 31 means to start their own private war. To ensure federation dominance. Half of Starfleet and our main ship are tasked to finding it.

Which takes the first season. They travel through out non federation space. Meeting new civilizations and interacting with old ones in new ways. Eventually finding the stolen ship and taking her back. Though not before the old excellsior class is destroyed and half the named crew dies. 

The captain and remaining crew are given this new ship, and joined by new crew. Now with the other hull modules. This ship, the USS Paladin, keeps the peace along federation border with the tholians. 
 ","Idea, next TV series(not counting Stewart's upcoming)"
736,"If you can be ""beamed up"" from anywhere to the Transporter room what's the point of the Transporter room. 

I'm I making sense?",What's the point of the Transporter room?
737,"Plot twist this isn't about Holodeck janitorial duties, and it's horrors.

With how often the Holodecks malfunction and quite often threaten one or more crew members, one must really think why are Holodecks standard in every ship and space station of the federation?",Holodecks
738,,Tig Notaro Dropping Tons of Spoilers for Season 2 of Discovery on The Late Late Show
739,,Local paper reviews Klingon M’aQ’betH in Washington state.
740,"I guess this may just be another way of asking for ""unpopular opinions""...but not really?

Basically, what are commonly held beliefs from the fandom you never took to or understood? 

  ",Commonly held Trek opinions/perceptions you never understood?
